polarity,review_id,sentence_id,text,op_category,op_target,op_OTE_offset,tokens
negative,1713185,1713185:0,"This place is really trendi but they have forgotten about the most important part of a  restaurant, the food.",FOOD#QUALITY,food,"('104', '108')","['This', 'place', 'really', 'trendi', 'forgotten', 'important', 'part', 'restaurant', 'food']"
positive,1713185,1713185:0,"This place is really trendi but they have forgotten about the most important part of a  restaurant, the food.",AMBIENCE#GENERAL,place,"('5', '10')","['This', 'place', 'really', 'trendi', 'forgotten', 'important', 'part', 'restaurant', 'food']"
negative,1713185,1713185:1,"The last two times I ordered from here my food was soo spicy that  I could barely eat it, and the spice took away from the flavor of the dish.",FOOD#QUALITY,food,"('42', '46')","['The', 'last', 'two', 'times', 'I', 'ordered', 'food', 'soo', 'spicy', 'I', 'could', 'barely', 'eat', 'spice', 'took', 'away', 'flavor', 'dish']"
negative,1713185,1713185:1,"The last two times I ordered from here my food was soo spicy that  I could barely eat it, and the spice took away from the flavor of the dish.",FOOD#QUALITY,spice,"('98', '103')","['The', 'last', 'two', 'times', 'I', 'ordered', 'food', 'soo', 'spicy', 'I', 'could', 'barely', 'eat', 'spice', 'took', 'away', 'flavor', 'dish']"
negative,1713185,1713185:2,And the Tom Kha soup was pathetic.,FOOD#QUALITY,Tom Kha soup,"('8', '20')","['And', 'Tom', 'Kha', 'soup', 'pathetic']"
negative,1713185,1713185:3,If you want good authentic Thai this place is not the place to go.,FOOD#QUALITY,Thai,"('27', '31')","['If', 'want', 'good', 'authentic', 'Thai', 'place', 'place', 'go']"
